--  MPP-21536: Duplicated rows inserted when ORCA is turned on
-- create test table
create table m();
NOTICE:  Table doesn't have 'DISTRIBUTED BY' clause, and no column type is suitable for a distribution key. Creating a NULL policy entry.
alter table m add column a int;
alter table m add column b int;
-- generate data for m
insert into m select i, i%5 from generate_series(1,10)i;
-- INSERT and UPDATE
create table yyy(a int, b int) distributed randomly;
insert into yyy select a,b from m;
select * from yyy order by 1, 2;
 a  | b 
----+---
  1 | 1
  2 | 2
  3 | 3
  4 | 4
  5 | 0
  6 | 1
  7 | 2
  8 | 3
  9 | 4
 10 | 0
(10 rows)

update yyy set a=m.b from m where m.a=yyy.b;
select * from yyy order by 1, 2;
 a  | b 
----+---
  1 | 1
  1 | 1
  2 | 2
  2 | 2
  3 | 3
  3 | 3
  4 | 4
  4 | 4
  5 | 0
 10 | 0
(10 rows)

drop table yyy;
-- UPDATE with different values
create table yyy(a int, b int) distributed randomly;
insert into yyy select a,b from m;
update yyy set b=m.b from m where m.a=yyy.a;
select * from yyy order by 1, 2;
 a  | b 
----+---
  1 | 1
  2 | 2
  3 | 3
  4 | 4
  5 | 0
  6 | 1
  7 | 2
  8 | 3
  9 | 4
 10 | 0
(10 rows)

drop table yyy;
-- DELETE
create table yyy(a int, b int) distributed randomly;
insert into yyy select a,b from m;
delete from yyy where a in (select a from m);
select * from yyy order by 1, 2;
 a | b 
---+---
(0 rows)

drop table yyy;
create table yyy(a int, b int) distributed randomly;
insert into yyy select a,b from m;
delete from yyy where b in (select a from m);
select * from yyy order by 1, 2;
 a  | b 
----+---
  5 | 0
 10 | 0
(2 rows)

drop table yyy;
-- Now repeat all the above tests, but using a hacked master-only 'm' table
drop table m;
set optimizer_enable_master_only_queries=on;
-- create master-only table
create table m();
NOTICE:  Table doesn't have 'DISTRIBUTED BY' clause, and no column type is suitable for a distribution key. Creating a NULL policy entry.
set allow_system_table_mods='DML';
delete from gp_distribution_policy where localoid='m'::regclass;
reset allow_system_table_mods;
alter table m add column a int;
alter table m add column b int;
-- generate data for m
insert into m select i, i%5 from generate_series(1,10)i;
create table zzz(a int primary key, b int) distributed by (a);
NOTICE:  CREATE TABLE / PRIMARY KEY will create implicit index "zzz_pkey" for table "zzz"
insert into zzz select a,b from m;
select * from zzz order by 1, 2;
 a  | b 
----+---
  1 | 1
  2 | 2
  3 | 3
  4 | 4
  5 | 0
  6 | 1
  7 | 2
  8 | 3
  9 | 4
 10 | 0
(10 rows)

delete from zzz where a in (select a from m);
select * from zzz order by 1, 2;
 a | b 
---+---
(0 rows)

drop table zzz;
create table zzz(a int primary key, b int) distributed by (a);
NOTICE:  CREATE TABLE / PRIMARY KEY will create implicit index "zzz_pkey" for table "zzz"
insert into zzz select a,b from m;
delete from zzz where b in (select a from m);
select * from zzz order by 1, 2;
 a  | b 
----+---
  5 | 0
 10 | 0
(2 rows)

drop table zzz;
create table zzz(a int primary key, b int) distributed by (a);
NOTICE:  CREATE TABLE / PRIMARY KEY will create implicit index "zzz_pkey" for table "zzz"
insert into zzz select a,b from m;
-- This update fails with duplicate key error, but it varies which segment
-- reports it first, i.e. it varies which row it complaints first. Silence
-- that difference in the error DETAIL line
\set VERBOSITY terse
update zzz set a=m.b from m where m.a=zzz.b;
ERROR:  Cannot parallelize an UPDATE statement that updates the distribution columns
select * from zzz order by 1, 2;
 a  | b 
----+---
  1 | 1
  2 | 2
  3 | 3
  4 | 4
  5 | 0
  6 | 1
  7 | 2
  8 | 3
  9 | 4
 10 | 0
(10 rows)

drop table zzz;
create table zzz(a int primary key, b int) distributed by (a);
NOTICE:  CREATE TABLE / PRIMARY KEY will create implicit index "zzz_pkey" for table "zzz"
insert into zzz select a,b from m;
update zzz set b=m.b from m where m.a=zzz.a;
select * from zzz order by 1, 2;
 a  | b 
----+---
  1 | 1
  2 | 2
  3 | 3
  4 | 4
  5 | 0
  6 | 1
  7 | 2
  8 | 3
  9 | 4
 10 | 0
(10 rows)

drop table zzz;
drop table m;
-- MPP-21622 Update with primary key: only sort if the primary key is updated
--
-- Aside from testing that bug, this also tests EXPLAIN of an DMLActionExpr
-- that ORCA generates for plans that update the primary key.
create table update_pk_test (a int primary key, b int) distributed by (a);
NOTICE:  CREATE TABLE / PRIMARY KEY will create implicit index "update_pk_test_pkey" for table "update_pk_test"
insert into update_pk_test values(1,1);
explain update update_pk_test set b = 5;
                             QUERY PLAN                              
---------------------------------------------------------------------
 Update (slice0; segments: 3)  (rows=1 width=14)
   ->  Seq Scan on update_pk_test  (cost=0.00..1.01 rows=1 width=14)
 Settings:  optimizer=off
 Optimizer status: legacy query optimizer
(4 rows)

update update_pk_test set b = 5;
select * from update_pk_test order by 1,2;
 a | b 
---+---
 1 | 5
(1 row)

explain update update_pk_test set a = 5;
ERROR:  Cannot parallelize an UPDATE statement that updates the distribution columns
update update_pk_test set a = 5;
ERROR:  Cannot parallelize an UPDATE statement that updates the distribution columns
select * from update_pk_test order by 1,2;
 a | b 
---+---
 1 | 5
(1 row)

--
-- Verify that ExecInsert doesn't scribble on the old tuple, when the new
-- tuple comes directly from the old table.
--
-- First insert a tuple into a table. Then insert another identical tuple, but
-- roll it back. If the insertion incorrectly modified the xmin on the old
-- tuple, then it will become invisible when we roll back.
--
-- GPDB_84_MERGE_FIXME: surely there's a better way to reproduce this failure
-- than creating a utility mode connection? I cannot reproduce except on
-- master-only tables (like system tables).
--
create external web table cmd(a text)
  execute E'PGOPTIONS="-c gp_session_role=utility"                         \\
    psql -p $GP_MASTER_PORT $GP_DATABASE $GP_USER -c                       \\
      "CREATE TABLE execinsert_test (id int4, t text);                     \\
       INSERT INTO execinsert_test values (1, ''foo'');"                   \\
                                                                           \\
    && PGOPTIONS="-c gp_session_role=utility"                              \\
    psql -p $GP_MASTER_PORT $GP_DATABASE $GP_USER -c                       \\
      "begin;                                                              \\
       INSERT INTO execinsert_test select * FROM execinsert_test;          \\
       rollback;"                                                          \\
                                                                           \\
    && PGOPTIONS="-c gp_session_role=utility"                              \\
    psql -p $GP_MASTER_PORT $GP_DATABASE $GP_USER -c                       \\
      "select * from execinsert_test;"                                     \\
                                                                           \\
    && PGOPTIONS="-c gp_session_role=utility"                              \\
    psql -p $GP_MASTER_PORT $GP_DATABASE $GP_USER -c                       \\
      "drop table execinsert_test;"'
  on master format 'text';
select * from cmd;
     a      
------------
 INSERT 0 1
 ROLLBACK
  id |  t  
 ----+-----
   1 | foo
 (1 row)
 
 DROP TABLE
(8 rows)

drop external web table cmd;
